{
  "$schema": "docs/architecture/compatibility-profiles.schema.json",
  "schema": "xr-foundry.compatibility_profiles.v2",
  "capability": {
    "reference_and_generation": "version_adaptive",
    "engine_version_binding": "exact_profile",
    "tool_version_binding": "exact_profile",
    "installable_manifest_versions": "concrete",
    "support_claim_source": "exact_verified_profile_only"
  },
  "evidence_policy": {
    "claim_unit": "exact_execution_tuple",
    "tuple_dimensions": [
      "engine",
      "editor",
      "renderer",
      "requested_dependencies",
      "resolved_dependencies",
      "build_target",
      "graphics_api",
      "scripting_backend",
      "architecture",
      "xr_provider",
      "runtime",
      "input_routes",
      "device"
    ],
    "cross_tuple_transfer_allowed": false,
    "unmatched_target": {
      "route": "raw_material_regeneration",
      "result_state": "candidate",
      "support_claim_allowed": false
    }
  },
  "allowed_states": [
    "candidate",
    "pending_automated_validation",
    "verified"
  ],
  "current_profile_ids": [
    "unity-6000.3-project-initializer-windows-editor",
    "unity-6000.3-xr-baseline-openxr-windows-editor",
    "unity-6000.3-inventory-core-windows-editor",
    "unity-6000.3-inventory-authoring-windows-editor",
    "unity-6000.3-inventory-presentation-windows-editor",
    "unity-6000.3-inventory-ugui-non-xr-windows-editor",
    "unity-6000.3-inventory-uitoolkit-non-xr-windows-editor",
    "unity-6000.3-inventory-xr-ugui-openxr-windows-editor",
    "unity-6000.3-inventory-xr-uitoolkit-openxr-windows-editor",
    "unity-6000.3-persistence-core-windows-editor",
    "unity-6000.3-persistence-unity-windows-editor",
    "unity-6000.3-settings-core-windows-editor",
    "unity-6000.3-settings-unity-windows-editor",
    "unity-6000.3-interaction-core-windows-editor"
  ],
  "profiles": [
    {
      "id": "unity-6000.3-project-initializer-windows-editor",
      "state": "verified",
      "install_artifact": "com.lingkyn.project-initializer",
      "target": {
        "engine": {
          "id": "unity",
          "version": "6000.3.19f1"
        },
        "editor": {
          "id": "unity-editor",
          "version": "6000.3.19f1"
        },
        "renderer": {
          "id": "not_applicable",
          "version": "not_applicable"
        },
        "requested_dependencies": {
          "com.unity.inputsystem": "1.19.0",
          "com.unity.render-pipelines.universal": "17.3.0",
          "com.unity.test-framework": "1.6.0"
        },
        "resolved_dependencies": {
          "com.unity.burst": "1.8.29",
          "com.unity.collections": "2.6.6",
          "com.unity.ext.nunit": "2.0.5",
          "com.unity.inputsystem": "1.19.0",
          "com.unity.mathematics": "1.3.3",
          "com.unity.modules.hierarchycore": "1.0.0",
          "com.unity.modules.imgui": "1.0.0",
          "com.unity.modules.jsonserialize": "1.0.0",
          "com.unity.modules.physics": "1.0.0",
          "com.unity.modules.terrain": "1.0.0",
          "com.unity.modules.ui": "1.0.0",
          "com.unity.modules.uielements": "1.0.0",
          "com.unity.nuget.mono-cecil": "1.11.6",
          "com.unity.render-pipelines.core": "17.3.0",
          "com.unity.render-pipelines.universal": "17.3.0",
          "com.unity.render-pipelines.universal-config": "17.0.3",
          "com.unity.searcher": "4.9.4",
          "com.unity.shadergraph": "17.3.0",
          "com.unity.test-framework": "1.6.0",
          "com.unity.test-framework.performance": "3.5.0",
          "com.unity.ugui": "2.0.0"
        },
        "build_target": "WindowsEditor",
        "graphics_api": "Null",
        "scripting_backend": "Mono",
        "architecture": "x86_64",
        "xr_provider": {
          "id": "not_applicable",
          "version": "not_applicable"
        },
        "runtime": {
          "id": "not_applicable",
          "version": "not_applicable"
        },
        "input_routes": [
          "not_applicable"
        ],
        "device": {
          "id": "windows-editor-host",
          "version": "10.0.26200"
        }
      },
      "package_versions": {
        "com.lingkyn.project-initializer": "0.1.0"
      },
      "verified_claims": [
        "editor_compile",
        "editmode_tests"
      ],
      "evidence": [
        {
          "kind": "editor_automated",
          "profile_id": "unity-6000.3-project-initializer-windows-editor",
          "commit_sha": "a25bbc7c9855ae4f094a58e43d8ab5ffdf37a7bf",
          "receipt_path": "docs/validation/evidence/unity-6000.3-project-initializer-windows-editor/compatibility-receipt.json",
          "manifest_sha256": "844586707238fc8e5005dd166e8f44bb74b8c7fcb7815ee3c29e1cc2568f587d",
          "lock_sha256": "390cdf16822e77f8d1f20a04b75f1222e29a5b99dfc491163b7f6bf1ecf78515",
          "checks": [
            "editor_compile",
            "editmode_tests"
          ]
        }
      ]
    },
    {
      "id": "unity-6000.3-xr-baseline-openxr-windows-editor",
      "state": "verified",
      "install_artifact": "com.lingkyn.xr-baseline",
      "target": {
        "engine": {
          "id": "unity",
          "version": "6000.3.19f1"
        },
        "editor": {
          "id": "unity-editor",
          "version": "6000.3.19f1"
        },
        "renderer": {
          "id": "not_applicable",
          "version": "not_applicable"
        },
        "requested_dependencies": {
          "com.unity.inputsystem": "1.19.0",
          "com.unity.test-framework": "1.6.0",
          "com.unity.xr.interaction.toolkit": "3.5.1",
          "com.unity.xr.management": "4.5.3",
          "com.unity.xr.openxr": "1.16.0"
        },
        "resolved_dependencies": {
          "com.unity.ext.nunit": "2.0.5",
          "com.unity.inputsystem": "1.19.0",
          "com.unity.mathematics": "1.3.3",
          "com.unity.modules.audio": "1.0.0",
          "com.unity.modules.hierarchycore": "1.0.0",
          "com.unity.modules.imgui": "1.0.0",
          "com.unity.modules.jsonserialize": "1.0.0",
          "com.unity.modules.physics": "1.0.0",
          "com.unity.modules.subsystems": "1.0.0",
          "com.unity.modules.ui": "1.0.0",
          "com.unity.modules.uielements": "1.0.0",
          "com.unity.modules.vr": "1.0.0",
          "com.unity.modules.xr": "1.0.0",
          "com.unity.test-framework": "1.6.0",
          "com.unity.ugui": "2.0.0",
          "com.unity.xr.core-utils": "2.6.0",
          "com.unity.xr.interaction.toolkit": "3.5.1",
          "com.unity.xr.legacyinputhelpers": "2.1.13",
          "com.unity.xr.management": "4.5.3",
          "com.unity.xr.openxr": "1.16.0"
        },
        "build_target": "WindowsEditor",
        "graphics_api": "Null",
        "scripting_backend": "Mono",
        "architecture": "x86_64",
        "xr_provider": {
          "id": "com.unity.xr.openxr",
          "version": "1.16.0"
        },
        "runtime": {
          "id": "not_applicable",
          "version": "not_applicable"
        },
        "input_routes": [
          "xri-controller",
          "xri-ray"
        ],
        "device": {
          "id": "windows-editor-host",
          "version": "10.0.26200"
        }
      },
      "package_versions": {
        "com.lingkyn.xr-baseline": "0.1.0"
      },
      "verified_claims": [
        "editor_compile",
        "editmode_tests"
      ],
      "evidence": [
        {
          "kind": "editor_automated",
          "profile_id": "unity-6000.3-xr-baseline-openxr-windows-editor",
          "commit_sha": "a25bbc7c9855ae4f094a58e43d8ab5ffdf37a7bf",
          "receipt_path": "docs/validation/evidence/unity-6000.3-xr-baseline-openxr-windows-editor/compatibility-receipt.json",
          "manifest_sha256": "b596bdf4d1289f5a4119690bfd004fcccacd7822fe3d6252533b3596bd3b15a0",
          "lock_sha256": "629f0017b90aea16b50d0f5f46fd8c8b0ec94d56ac1f98edebb39a5fe3740a6d",
          "checks": [
            "editor_compile",
            "editmode_tests"
          ]
        }
      ]
    },
    {
      "id": "unity-6000.3-inventory-core-windows-editor",
      "state": "verified",
      "install_artifact": "com.lingkyn.inventory.core",
      "target": {
        "engine": {
          "id": "unity",
          "version": "6000.3.19f1"
        },
        "editor": {
          "id": "unity-editor",
          "version": "6000.3.19f1"
        },
        "renderer": {
          "id": "not_applicable",
          "version": "not_applicable"
        },
        "requested_dependencies": {
          "com.unity.test-framework": "1.6.0"
        },
        "resolved_dependencies": {
          "com.unity.ext.nunit": "2.0.5",
          "com.unity.modules.imgui": "1.0.0",
          "com.unity.modules.jsonserialize": "1.0.0",
          "com.unity.test-framework": "1.6.0"
        },
        "build_target": "WindowsEditor",
        "graphics_api": "Null",
        "scripting_backend": "Mono",
        "architecture": "x86_64",
        "xr_provider": {
          "id": "not_applicable",
          "version": "not_applicable"
        },
        "runtime": {
          "id": "not_applicable",
          "version": "not_applicable"
        },
        "input_routes": [
          "not_applicable"
        ],
        "device": {
          "id": "windows-editor-host",
          "version": "10.0.26200"
        }
      },
      "package_versions": {
        "com.lingkyn.inventory.core": "0.1.1"
      },
      "verified_claims": [
        "editor_compile",
        "editmode_tests"
      ],
      "evidence": [
        {
          "kind": "editor_automated",
          "profile_id": "unity-6000.3-inventory-core-windows-editor",
          "commit_sha": "a25bbc7c9855ae4f094a58e43d8ab5ffdf37a7bf",
          "receipt_path": "docs/validation/evidence/unity-6000.3-inventory-core-windows-editor/compatibility-receipt.json",
          "manifest_sha256": "d63620753ec91a32e946d69870e366197dee2f92f0fd1ad7d4947e253ec100db",